{
  "schema_version": 1,
  "owner": {
    "workspace_id": "workspace-example",
    "request_ref": "018f0000-0000-7000-8000-000000058001"
  },
  "server_key": "bbbbbbbbbbbbbbbbbbbbbbbbbbbbbbbbbbbbbbbbbbbbbbbbbbbbbbbbbbbbbbbb",
  "server_epoch": 1,
  "launch_token": "018f0000-0000-7000-8000-000000058006",
  "phase": "reserved",
  "state": null
}
